{
  "documentId": "conformance-runtime-doc",
  "revision": 0,
  "appKind": "python-openrpc-demo",
  "nodes": [
    {
      "id": "on-play",
      "type": "system/on-play",
      "title": "On Play",
      "layout": {
        "x": 0,
        "y": 0,
        "width": 220,
        "height": 120
      },
      "outputs": [
        {
          "name": "Event",
          "type": "event"
        }
      ]
    },
    {
      "id": "counter",
      "type": "template/execute-counter",
      "title": "Counter Source",
      "layout": {
        "x": 280,
        "y": 0,
        "width": 288,
        "height": 184
      },
      "properties": {
        "subtitle": "等待起跑",
        "status": "READY",
        "count": 0
      },
      "inputs": [
        {
          "name": "Start",
          "type": "event"
        }
      ],
      "outputs": [
        {
          "name": "Count",
          "type": "number"
        }
      ]
    },
    {
      "id": "display",
      "type": "template/execute-display",
      "title": "Display",
      "layout": {
        "x": 620,
        "y": 0,
        "width": 288,
        "height": 184
      },
      "properties": {
        "subtitle": "等待上游执行传播",
        "status": "WAITING"
      },
      "inputs": [
        {
          "name": "Value",
          "type": "number"
        }
      ]
    }
  ],
  "links": [
    {
      "id": "link:on-play->counter",
      "source": {
        "nodeId": "on-play",
        "slot": 0
      },
      "target": {
        "nodeId": "counter",
        "slot": 0
      }
    },
    {
      "id": "link:counter->display",
      "source": {
        "nodeId": "counter",
        "slot": 0
      },
      "target": {
        "nodeId": "display",
        "slot": 0
      }
    }
  ],
  "meta": {
    "source": "conformance"
  }
}
